{
 "id": "OGIR-M9-016",
 "title": "No arbitrary TPM commands from games",
 "attacker": "A3",
 "owner": "initial-maintainer",
 "required_assurance_profile": "all-protected-modes",
 "assets": [
  "integrity_of_trust_decisions"
 ],
 "preconditions": [
  "the referenced house suite is part of the release gate"
 ],
 "steps": [
  "run the referenced suite entry",
  "observe the recorded outcome"
 ],
 "expected": {
  "decision": "deny",
  "reason": "invariant-covered",
  "automatic_ban": false
 },
 "invariants": [
  "invariant 16: Games cannot submit arbitrary commands to the physical TPM."
 ],
 "residual_risk": [
  "registry mapping for the daemon exploitation family; the executable leg is the referenced suite; executable evidence: the ADR-0029 bridge review: no TPM call, no privileged operation anywhere in the bridge"
 ]
}
