{
 "id": "OGIR-M9-017",
 "title": "Raw Windows TPM terminates at a virtual TPM",
 "attacker": "A3",
 "owner": "initial-maintainer",
 "required_assurance_profile": "all-protected-modes",
 "assets": [
  "integrity_of_trust_decisions"
 ],
 "preconditions": [
  "the referenced house suite is part of the release gate"
 ],
 "steps": [
  "run the referenced suite entry",
  "observe the recorded outcome"
 ],
 "expected": {
  "decision": "deny",
  "reason": "invariant-covered",
  "automatic_ban": false
 },
 "invariants": [
  "invariant 17: Raw Windows TPM compatibility terminates at an isolated virtual TPM."
 ],
 "residual_risk": [
  "registry mapping for the memory modification and instrumentation family; the executable leg is the referenced suite; executable evidence: the roadmap's Wine TPM compatibility track boundary (M10) plus the TBS non-forwarding rule in wine/README.md"
 ]
}
