{
 "id": "OGIR-M9-031",
 "title": "Privileged operations authorized against the challenge",
 "attacker": "A3",
 "owner": "initial-maintainer",
 "required_assurance_profile": "all-protected-modes",
 "assets": [
  "integrity_of_trust_decisions"
 ],
 "preconditions": [
  "the referenced house suite is part of the release gate"
 ],
 "steps": [
  "run the referenced suite entry",
  "observe the recorded outcome"
 ],
 "expected": {
  "decision": "deny",
  "reason": "invariant-covered",
  "automatic_ban": false
 },
 "invariants": [
  "invariant 31: Privileged operations are authorized against the authenticated caller, signed challenge, and selected local policy."
 ],
 "residual_risk": [
  "registry mapping for the verifier/policy/reference compromise family; the executable leg is the referenced suite; executable evidence: the M6 evidence flow: every route consumes the signed challenge; the M4 manifest gates admission"
 ]
}
